{
  "snapshot_id": "sha256:dddddddddddddddddddddddddddddddddddddddddddddddddddddddddddddddd",
  "protocol": "qsol-control-collection-snapshot/1",
  "collection_id": "sha256:cccccccccccccccccccccccccccccccccccccccccccccccccccccccccccccccc",
  "revision": 1,
  "previous_snapshot_id": "sha256:eeeeeeeeeeeeeeeeeeeeeeeeeeeeeeeeeeeeeeeeeeeeeeeeeeeeeeeeeeeeeeee",
  "created_at": "2026-08-18T07:45:00+09:30",
  "members": [
    "sha256:aaaaaaaaaaaaaaaaaaaaaaaaaaaaaaaaaaaaaaaaaaaaaaaaaaaaaaaaaaaaaaaa"
  ]
}
